{
  "$schema": "../../../schemas/records/software-edition.schema.json",
  "schema_version": "1.0.0",
  "id": "edition.cpm_aurelia.z80",
  "record_type": "software-edition",
  "data": {
    "id": "edition.cpm_aurelia.z80",
    "name": "Enhanced CP/M 1.4 for Logix Aurelia — z80",
    "product_ref": "software.cpm_aurelia",
    "execution_target": "z80_cpm",
    "role": "operating_system",
    "introduced": {
      "event_name": "NCC 1978 — Logix Aurelia launch",
      "event_start_date": "1978-06-05"
    },
    "platform_support": [
      {
        "computer_ref": "computer.aurelia",
        "available_from": "1978-06-05"
      },
      {
        "computer_ref": "computer.aurelia_plus",
        "available_from": "1979-12-03"
      }
    ],
    "minimum_resources": {
      "installed_ram_kb": 48,
      "application_ram_bytes": null,
      "rom_bytes": null,
      "status": "Compatibility contract; measured workspace and image budgets pending."
    },
    "dependency_refs": [],
    "delivery": [
      "mainboard XIP ROM",
      "System ROM cartridge"
    ],
    "support_status": "declared compatible; implementation conformance and performance not yet measured"
  }
}
